Article Link,Article Name,Site Name,Date,Time
https://news.google.com/articles/CBMiWGh0dHBzOi8vd3d3Lndzai5jb20vYXJ0aWNsZXMvdGhlLW1hbnktcGxhY2VzLWFtYXpvbi1jZW8tamVmZi1iZXpvcy1jYWxscy1ob21lLTE1MDcyMDQ0NjLSAQA?hl=en-GB&gl=GB&ceid=GB%3Aen,The Many Places Amazon CEO Jeff Bezos Calls Home,wsj,2017-10-05,11:54:56
https://news.google.com/articles/CBMiLGh0dHBzOi8vd3d3LmJiYy5jb20vbmV3cy90b3BpY3MvYzhucTMyandqbm100gEA?hl=en-GB&gl=GB&ceid=GB%3Aen,Tesla,bbc,2018-06-17,05:15:33
https://news.google.com/articles/CBMiLGh0dHBzOi8vd3d3LmJiYy5jb20vbmV3cy90b3BpY3MvY2V3cmxxejg0N3l00gEA?hl=en-GB&gl=GB&ceid=GB%3Aen,Nvidia,bbc,2018-07-16,10:15:30
https://news.google.com/articles/CBMiUGh0dHBzOi8vd3d3LmJiYy5jb20vcmVlbC92aWRlby9wMDZ5Y2RscS90aGUtbG9zdC10b3duLWluLXRoZS1oZWFydC1vZi10aGUtYW1hem9u0gEA?hl=en-GB&gl=GB&ceid=GB%3Aen,The lost town in the heart of the Amazon,bbc,2019-01-23,18:05:34
https://news.google.com/articles/CBMiXmh0dHBzOi8vd3d3LmJsb29tYmVyZy5jb20vY29tcGFueS9wcmVzcy9ibG9vbWJlcmctYnVzaW5lc3MtbmV3cy1zZXJ2aWNlLWFtYXpvbi1maXJlLXR2LWxhdW5jaC_SAQA?hl=en-GB&gl=GB&ceid=GB%3Aen,Bloomberg is Only Business News Service on Amazon Fire TV at Launch | Press,bloomberg,2019-08-30,13:46:22
https://news.google.com/articles/CBMiWWh0dHBzOi8vd3d3LmJiYy5jb20vcmVlbC92aWRlby9wMGIyNHo3Zi90aGUtbWFuLW1hZGUtZ3JlZWstZm9yZXN0LXRoYXQtbWlycm9ycy10aGUtYW1hem9u0gEA?hl=en-GB&gl=GB&ceid=GB%3Aen,The man-made Greek forest that mirrors the Amazon,bbc,2021-11-04,23:14:46
https://news.google.com/articles/CBMiLGh0dHBzOi8vd3d3LmJiYy5jb20vbmV3cy90b3BpY3MvY20xcm05ejI1OWt00gEA?hl=en-GB&gl=GB&ceid=GB%3Aen,Meta,bbc,2021-11-25,20:41:09
https://news.google.com/articles/CBMiS2h0dHBzOi8vY2hhbm5lbHMuZnQuY29tL2VuL3RlY2gvd2lsbC10ZXNsYXMtb3B0aW11cy1yb2JvdC1iZWNvbWUtYS1yZWFsaXR5L9IBAA?hl=en-GB&gl=GB&ceid=GB%3Aen,Will Tesla's Optimus robot become a reality?,ft,2022-09-24,11:27:43
https://news.google.com/articles/CBMicGh0dHBzOi8vd3d3Lndzai5jb20vYXJ0cy1jdWx0dXJlLzYtbW92aWVzLWFuZC1zZXJpZXMtdG8tc3RyZWFtLW9uLWFtYXpvbi1wcmltZS12aWRlby1pbi0yMDIzLWFpcmRpZ2l0YWwtYmQwY2ZjYzDSAQA?hl=en-GB&gl=GB&ceid=GB%3Aen,6 Movies and Series to Stream on Amazon Prime Video in 2023,wsj,2023-06-23,07:00:00
https://news.google.com/articles/CBMiggFodHRwczovL3d3dy5mb3JiZXMuY29tL3NpdGVzL3NhcmFoZG9vZHkvMjAyMy8wNi8yMi80LWpvYi1zZWFyY2gtbGVzc29ucy1mcm9tLWhpcmluZy1tYW5hZ2Vycy13aG92ZS13b3JrZWQtYXQtbWV0YS1zaG9waWZ5LWFuZC1pYm0v0gEA?hl=en-GB&gl=GB&ceid=GB%3Aen,"4 Job Search Lessons From Hiring Managers Who've Worked At Meta, Shopify And IBM",forbes,2023-06-23,07:00:00
https://news.google.com/articles/CBMilwFodHRwczovL3d3dy53c2ouY29tL3ZpZGVvL3Nlcmllcy90ZWNoLW5ld3MtYnJpZWZpbmcvZ29vZ2xlcy1sYXRlc3QtYWktZmxleC1hbi1hbnRpLW1vbmV5LWxhdW5kZXJpbmctdG9vbC1mb3ItYmFua3MvNjUxMEZEQ0QtQzhEMi00NEYzLUIwMjEtQ0I1RjczNEExMUFF0gEA?hl=en-GB&gl=GB&ceid=GB%3Aen,Google’s Latest AI Flex: An Anti-Money-Laundering Tool for Banks,wsj,2023-06-25,07:00:00
https://news.google.com/articles/CBMiN2h0dHBzOi8vd3d3LmJiYy5jb20vbmV3cy91ay1lbmdsYW5kLWRlcmJ5c2hpcmUtNjYwMTQxMjjSATtodHRwczovL3d3dy5iYmMuY29tL25ld3MvdWstZW5nbGFuZC1kZXJieXNoaXJlLTY2MDE0MTI4LmFtcA?hl=en-GB&gl=GB&ceid=GB%3Aen,Tideswell: Man in drink-drive arrest after 11 injured by Tesla,bbc,2023-06-25,07:00:00
https://news.google.com/articles/CBMiN2h0dHBzOi8vd3d3LmJiYy5jb20vbmV3cy9hdi9lbnRlcnRhaW5tZW50LWFydHMtNjYwMzk1MDLSAQA?hl=en-GB&gl=GB&ceid=GB%3Aen,'It's so disheartening' - Dolly Parton tribute act stages protest over Meta 'ban',bbc,2023-06-27,07:00:00
https://news.google.com/articles/CBMiKmh0dHBzOi8vd3d3LmJiYy5jb20vbmV3cy9idXNpbmVzcy02NjAyNzA3M9IBLmh0dHBzOi8vd3d3LmJiYy5jb20vbmV3cy9idXNpbmVzcy02NjAyNzA3My5hbXA?hl=en-GB&gl=GB&ceid=GB%3Aen,Meta: Facebook owner launches $7.99 a month virtual reality service,bbc,2023-06-27,07:00:00
https://news.google.com/articles/CBMiNGh0dHBzOi8vd3d3LmJiYy5jb20vbmV3cy9lbnRlcnRhaW5tZW50LWFydHMtNjYwMjg5NzbSAThodHRwczovL3d3dy5iYmMuY29tL25ld3MvZW50ZXJ0YWlubWVudC1hcnRzLTY2MDI4OTc2LmFtcA?hl=en-GB&gl=GB&ceid=GB%3Aen,"Dolly Parton, Britney Spears and Taylor Swift tribute acts stage protest over Meta 'ban'",bbc,2023-06-27,07:00:00
https://news.google.com/articles/CBMibGh0dHBzOi8vd3d3Lm55dGltZXMuY29tLzIwMjMvMDYvMjcvYnVzaW5lc3MvZW5lcmd5LWVudmlyb25tZW50L3Rlc2xhLWdtLWZvcmQtY2hhcmdpbmctZWxlY3RyaWMtdmVoaWNsZXMuaHRtbNIBAA?hl=en-GB&gl=GB&ceid=GB%3Aen,Tesla May Have Already Won the Charging Wars,nytimes,2023-06-27,07:00:00
https://news.google.com/articles/CBMib2h0dHBzOi8vd3d3Lndzai5jb20vYXJ0aWNsZXMvZmxleHBvcnRzLWRhdmUtY2xhcmstb24tdGhlLXR1cm4tZnJvbS1hbWF6b24tbG9naXN0aWNzLXRvLWZyZWlnaHQtbWFya2V0cy1iOTdiM2NlNtIBAA?hl=en-GB&gl=GB&ceid=GB%3Aen,Flexport's Dave Clark on the Turn From Amazon Logistics to Freight Markets,wsj,2023-06-28,07:00:00
https://news.google.com/articles/CBMiUWh0dHBzOi8vd3d3Lm55dGltZXMuY29tLzIwMjMvMDYvMjgvYnVzaW5lc3MvbWljcm9zb2Z0LWFjdGl2aXNpb24tY2VvLXRlc3RpZnkuaHRtbNIBAA?hl=en-GB&gl=GB&ceid=GB%3Aen,Microsoft and Activision Chiefs Testify Merger Will Benefit Consumers,nytimes,2023-06-28,07:00:00
https://news.google.com/articles/CBMiP2h0dHBzOi8vd3d3LmZ0LmNvbS9jb250ZW50LzRjZDM2OWEwLTQ5YzUtNGI3Yy1iZDRhLTA1ZTU0N2RlYjRiM9IBAA?hl=en-GB&gl=GB&ceid=GB%3Aen,Microsoft and Activision CEOs fight for their $75bn deal in court hearing,ft,2023-06-28,07:00:00
https://news.google.com/articles/CBMiW2h0dHBzOi8vd3d3LmZvcmJlcy5jb20vc2l0ZXMvZm9yYmVzLXBlcnNvbmFsLXNob3BwZXIvMjAyMy8wNi8yOC9nb29nbGUtcGl4ZWwtdGFibGV0LXJldmlldy_SAQA?hl=en-GB&gl=GB&ceid=GB%3Aen,Google Pixel Tablet Review: A Slate Transformed By Its Speaker Dock,forbes,2023-06-28,07:00:00
https://news.google.com/articles/CBMiSmh0dHBzOi8vd3d3Lm55dGltZXMuY29tL25ld3NncmFwaGljcy9jYXJkLXN0b3J5L2FzdGVyb2lkLWNpdHktd2VzLWFuZGVyc29u0gFKaHR0cHM6Ly93d3cubnl0aW1lcy5jb20vbmV3c2dyYXBoaWNzL2NhcmQtc3RvcnkvYXN0ZXJvaWQtY2l0eS13ZXMtYW5kZXJzb24?hl=en-GB&gl=GB&ceid=GB%3Aen,‘Asteroid City’: Wes Anderson and His All-Stars Go Meta,nytimes,2023-06-28,20:02:48
https://news.google.com/articles/CBMiN2h0dHBzOi8vd3d3LmJiYy5jb20vbmV3cy91ay1lbmdsYW5kLWJpcm1pbmdoYW0tNjYwNDQ4MDjSATtodHRwczovL3d3dy5iYmMuY29tL25ld3MvdWstZW5nbGFuZC1iaXJtaW5naGFtLTY2MDQ0ODA4LmFtcA?hl=en-GB&gl=GB&ceid=GB%3Aen,Rugeley's Amazon site to close as new centre reopens,bbc,2023-06-29,07:00:00
https://news.google.com/articles/CBMidmh0dHBzOi8vd3d3Lndzai5jb20vYXJ0aWNsZXMvbWljcm9zb2Z0LWFjdGl2aXNpb24taGVhcmluZy1zZXQtdG8td3JhcC11cC1hcy1mdGMtdHJpZXMtdG8tc3RvcC03NS1iaWxsaW9uLWRlYWwtYTA1NDBiOGbSAQA?hl=en-GB&gl=GB&ceid=GB%3Aen,Microsoft-Activision Hearing Wraps Up as FTC Tries to Stop $75 Billion Deal,wsj,2023-06-29,07:00:00
https://news.google.com/articles/CBMicGh0dHBzOi8vd3d3LmJsb29tYmVyZy5jb20vbmV3cy9hcnRpY2xlcy8yMDIzLTA2LTI5L2FpLXZpZGVvLXN0YXJ0dXAtcnVud2F5LXJhaXNlcy0xNDEtbWlsbGlvbi1mcm9tLWdvb2dsZS1udmlkaWHSAQA?hl=en-GB&gl=GB&ceid=GB%3Aen,"AI Video Startup Runway Raises $141 Million From Google, Nvidia",bloomberg,2023-06-29,07:00:00
https://news.google.com/articles/CBMid2h0dHBzOi8vd3d3LmZvcmJlcy5jb20vc2l0ZXMvbWljaGFlbGhhcmxleS8yMDIzLzA2LzI5L2Fub3RoZXItd2luLWZvci10ZXNsYS1zYWUtYW5ub3VuY2VzLWl0LWlzLXNldHRpbmctbmFjcy1zdGFuZGFyZHMv0gEA?hl=en-GB&gl=GB&ceid=GB%3Aen,Another Win For Tesla: SAE Announces It Is Setting NACS Standards,forbes,2023-06-29,07:00:00
https://news.google.com/articles/CBMigQFodHRwczovL3d3dy53c2ouY29tL2FydGljbGVzL2V0aGljcy1vZmZpY2lhbC1vd25lZC1tZXRhLXN0b2NrLXdoaWxlLXJlY29tbWVuZGluZy1mdGMtY2hhaXItcmVjdXNlLWhlcnNlbGYtZnJvbS1tZXRhLWNhc2UtODU4MmE4M2LSAQA?hl=en-GB&gl=GB&ceid=GB%3Aen,Ethics Official Owned Meta Stock While Recommending FTC Chair Recuse Herself From Meta Case,wsj,2023-06-30,07:00:00
https://news.google.com/articles/CBMiZGh0dHBzOi8vd3d3Lndzai5jb20vYXJ0aWNsZXMvZ29sZG1hbi1pcy1sb29raW5nLWZvci1hLXdheS1vdXQtb2YtaXRzLXBhcnRuZXJzaGlwLXdpdGgtYXBwbGUtNzk4NDlhOTHSAQA?hl=en-GB&gl=GB&ceid=GB%3Aen,Goldman Is Looking for a Way Out of Its Partnership With Apple,wsj,2023-06-30,07:00:00
https://news.google.com/articles/CBMiP2h0dHBzOi8vd3d3LmZ0LmNvbS9jb250ZW50L2VkNTQzZjEzLWM2NGItNGQ2MS1hNWZkLTFkYzMxZGMzNzNjZNIBAA?hl=en-GB&gl=GB&ceid=GB%3Aen,Volkswagen/Tesla: plugging the gap in electric vehicle charger standards,ft,2023-06-30,07:00:00
https://news.google.com/articles/CBMihAFodHRwczovL3d3dy5mb3JiZXMuY29tL3NpdGVzL2pvYW5taWNoZWxzb24yLzIwMjMvMDcvMDEvZ20tY2VvLW1hcnktYmFycmEtb24tcGl2b3RpbmctdG8tZWxlY3RyaWMtdmVoaWNsZXMtYW5kLXBhcnRuZXJpbmctd2l0aC10ZXNsYS_SAQA?hl=en-GB&gl=GB&ceid=GB%3Aen,GM CEO Mary Barra On Pivoting To Electric Vehicles And Partnering With Tesla,forbes,2023-07-01,07:00:00
https://news.google.com/articles/CBMiRGh0dHBzOi8vd3d3Lndzai5jb20vYXJ0aWNsZXMvd2hvLXNob3VsZC1idXktYS1mb2xkaW5nLXBob25lLTJmNjU4OTY50gEA?hl=en-GB&gl=GB&ceid=GB%3Aen,Folding Phone Battle: Google Pixel Fold vs. Samsung Galaxy Z Fold,wsj,2023-07-02,07:00:00
https://news.google.com/articles/CBMiKmh0dHBzOi8vd3d3LmJiYy5jb20vbmV3cy9idXNpbmVzcy02NjA4MzMyOdIBLmh0dHBzOi8vd3d3LmJiYy5jb20vbmV3cy9idXNpbmVzcy02NjA4MzMyOS5hbXA?hl=en-GB&gl=GB&ceid=GB%3Aen,Elon Musk: Tesla delivers record number of cars after price cuts,bbc,2023-07-02,07:00:00
https://news.google.com/articles/CBMiYGh0dHBzOi8vd3d3Lndzai5jb20vYXJ0aWNsZXMvdGVzbGEtZGVsaXZlcmllcy10by1zaG93LXdoZXRoZXItcHJpY2UtY3V0cy1hcmUtcGF5aW5nLW9mZi0yZjJhYWM5M9IBAA?hl=en-GB&gl=GB&ceid=GB%3Aen,Tesla Deliveries Rose 83% in the Latest Quarter,wsj,2023-07-02,07:00:00
https://news.google.com/articles/CBMiSmh0dHBzOi8vd3d3Lm55dGltZXMuY29tLzIwMjMvMDcvMDIvYnVzaW5lc3MvdGVzbGEtcTItc2FsZXMtZGVsaXZlcmllcy5odG1s0gEA?hl=en-GB&gl=GB&ceid=GB%3Aen,Tesla’s Second Quarter Sales and Deliveries Rise as Tax Credits Fuel Demand,nytimes,2023-07-02,07:00:00
https://news.google.com/articles/CBMiQ2h0dHBzOi8vd3d3Lm55dGltZXMuY29tLzIwMjMvMDcvMDMvdGVjaG5vbG9neS9tZXRhLWFwcC10d2l0dGVyLmh0bWzSAQA?hl=en-GB&gl=GB&ceid=GB%3Aen,Meta Unveils ‘Threads’ App to Take on Twitter,nytimes,2023-07-03,07:00:00
https://news.google.com/articles/CBMiamh0dHBzOi8vd3d3LmJsb29tYmVyZy5jb20vb3Bpbmlvbi9hcnRpY2xlcy8yMDIzLTA3LTAzL3R3aXR0ZXItcy10cm91Ymxlcy1jb21lLWF0LXRoZS1wZXJmZWN0LXRpbWUtZm9yLW1ldGHSAQA?hl=en-GB&gl=GB&ceid=GB%3Aen,Twitter’s Troubles Come at the Perfect Time for Meta,bloomberg,2023-07-03,07:00:00
https://news.google.com/articles/CBMiQmh0dHBzOi8vd3d3Lm55dGltZXMuY29tLzIwMjMvMDcvMDQvYnVzaW5lc3MvbWV0YS1nZXJtYW55LWRhdGEuaHRtbNIBAA?hl=en-GB&gl=GB&ceid=GB%3Aen,Meta Loses Appeal on How It Harvests Data in Germany,nytimes,2023-07-04,07:00:00
https://news.google.com/articles/CBMiP2h0dHBzOi8vd3d3LmZ0LmNvbS9jb250ZW50Lzk5OTQzY2UzLTk2YmEtNGFjYi1hYTAyLTUwYjJlZTM1MmE0N9IBAA?hl=en-GB&gl=GB&ceid=GB%3Aen,The Horror of Dolores Roach review — Amazon's cannibal comedy is both killer and filler,ft,2023-07-05,07:00:00
https://news.google.com/articles/CBMiSGh0dHBzOi8vd3d3Lndzai5jb20vbGl2ZWNvdmVyYWdlL3N0b2NrLW1hcmtldC10b2RheS1kb3ctam9uZXMtMDctMDUtMjAyM9IBAA?hl=en-GB&gl=GB&ceid=GB%3Aen,"Stock Market News, July 5, 2023: Indexes End Lower; Meta Rises, Oil Climbs",wsj,2023-07-05,07:00:00
https://news.google.com/articles/CBMic2h0dHBzOi8vd3d3LmJsb29tYmVyZy5jb20vbmV3cy9hcnRpY2xlcy8yMDIzLTA3LTA2L3p1Y2tlcmJlcmctcG9zdHMtZmlyc3QtdHdlZXQtaW4tMTEteWVhcnMtaW4tdGhyZWFkcy1qaWJlLWF0LW11c2vSAQA?hl=en-GB&gl=GB&ceid=GB%3Aen,Meta's Zuckerberg Tweets After Instagram Threads Launch in Jab at Musk's Twitter,bloomberg,2023-07-05,07:00:00
https://news.google.com/articles/CBMiLGh0dHBzOi8vd3d3LmJiYy5jb20vbmV3cy90ZWNobm9sb2d5LTY2MTEyNjQ40gEwaHR0cHM6Ly93d3cuYmJjLmNvbS9uZXdzL3RlY2hub2xvZ3ktNjYxMTI2NDguYW1w?hl=en-GB&gl=GB&ceid=GB%3Aen,"Thirty million join Meta's Twitter rival Threads, Zuckerberg says",bbc,2023-07-06,07:00:00
https://news.google.com/articles/CBMiT2h0dHBzOi8vd3d3Lndzai5jb20vYXJ0aWNsZXMvbWV0YS10aHJlYWRzLWluc3RhZ3JhbS10d2l0dGVyLWNvbXBldGl0b3ItYzY4NzE0ZjfSAQA?hl=en-GB&gl=GB&ceid=GB%3Aen,"Day After Threads Launches, Twitter Accuses Meta of Using Its Trade Secrets",wsj,2023-07-06,07:00:00
https://news.google.com/articles/CBMicWh0dHBzOi8vd3d3Lndzai5jb20vYXJ0aWNsZXMvZWFybHktc3VjY2Vzcy1vZi1tZXRhcy10aHJlYWRzLWlzLWFscmVhZHktZHJhd2luZy1pbnRlcmVzdC1mcm9tLWFkdmVydGlzZXJzLWJhNjdkNzIy0gEA?hl=en-GB&gl=GB&ceid=GB%3Aen,"Meta's Threads App Sees Early Success, Drawing Advertiser Interest and Twitter's Ire",wsj,2023-07-06,07:00:00
https://news.google.com/articles/CBMiTGh0dHBzOi8vd3d3Lm55dGltZXMuY29tLzIwMjMvMDcvMDYvdGVjaG5vbG9neS90aHJlYWRzLWRvd25sb2Fkcy10d2l0dGVyLmh0bWzSAQA?hl=en-GB&gl=GB&ceid=GB%3Aen,Threads Becomes Most Rapidly Downloaded App as Twitter Threatens Meta,nytimes,2023-07-06,07:00:00
https://news.google.com/articles/CBMibmh0dHBzOi8vd3d3Lm55dGltZXMuY29tLzIwMjMvMDcvMDYvcG9kY2FzdHMvc3BlY2lhbC1lcGlzb2RlLW1ldGFzLXR3aXR0ZXItcml2YWwtYXJyaXZlcy13aXRoLWFkYW0tbW9zc2VyaS5odG1s0gEA?hl=en-GB&gl=GB&ceid=GB%3Aen,"Special Episode: Meta's Twitter Rival Arrives, with Adam Mosseri",nytimes,2023-07-06,07:00:00
https://news.google.com/articles/CBMieGh0dHBzOi8vd3d3LmZvcmJlcy5jb20vc2l0ZXMvZGVyZWtzYXVsLzIwMjMvMDcvMDYvaGVyZXMtaG93LW11Y2gtbWV0YS1zdG9jay1jb3VsZC1zdXJnZS10aGFua3MtdG8tdHdpdHRlci1yaXZhbC10aHJlYWRzL9IBAA?hl=en-GB&gl=GB&ceid=GB%3Aen,Here’s How Much Meta Stock Could Surge Thanks To Twitter Rival Threads,forbes,2023-07-06,07:00:00
https://news.google.com/articles/CBMirwFodHRwczovL3d3dy5mb3JiZXMuY29tL3NpdGVzL3dpbGxza2lwd29ydGgvMjAyMy8wNy8wNi90aGVzZS1iaWxsaW9uYWlyZXMtcG9wLXN0YXJzLWFuZC1wb2xpdGljaWFucy1oYXZlLWFscmVhZHktc2lnbmVkLXVwLWZvci1tZXRhcy10aHJlYWRzLWFwcC1iaWxsLWdhdGVzLWRhbGFpLWxhbWEtYW5kLW1vcmUv0gEA?hl=en-GB&gl=GB&ceid=GB%3Aen,"These Billionaires, Pop Stars And Politicians Have Already Signed Up For Meta's Threads App—Bill Gates, Dalai Lama ...",forbes,2023-07-06,07:00:00
https://news.google.com/articles/CBMib2h0dHBzOi8vd3d3LmZvcmJlcy5jb20vc2l0ZXMvZXJpa2thaW4vMjAyMy8wNy8wNi9ob3ctdG8tZG93bmxvYWQtdGhyZWFkcy1ieS1pbnN0YWdyYW0tbWV0YXMtbmV3LXR3aXR0ZXIta2lsbGVyL9IBAA?hl=en-GB&gl=GB&ceid=GB%3Aen,"How To Download Threads By Instagram, Meta’s New Twitter-Killer",forbes,2023-07-06,07:00:00
https://news.google.com/articles/CBMigAFodHRwczovL3d3dy5ibG9vbWJlcmcuY29tL29waW5pb24vYXJ0aWNsZXMvMjAyMy0wNy0wNi96dWNrZXJiZXJnLWhhcmQtbGF1bmNoZWQtbWV0YS1zLXRocmVhZHMtdG8tdG9wLW11c2stYW5kLWl0LXdvcmtlZC1sanJvaTBxONIBAA?hl=en-GB&gl=GB&ceid=GB%3Aen,Zuckerberg Hard-Launched Meta's Threads to Top Musk and It Worked.,bloomberg,2023-07-06,07:00:00
https://news.google.com/articles/CBMiP2h0dHBzOi8vd3d3LmZ0LmNvbS9jb250ZW50LzYzYjI3ZTcxLWM1NjgtNDlkNC05YTAzLWFhNDhmODM5N2EyN9IBAA?hl=en-GB&gl=GB&ceid=GB%3Aen,Meta says 30mn people have signed up to Twitter competitor Threads,ft,2023-07-06,07:00:00
https://news.google.com/articles/CBMiP2h0dHBzOi8vd3d3LmZ0LmNvbS9jb250ZW50LzczYzMyYWNjLTU5N2UtNDdlZS05NzQ1LWU3Y2ZhODBmYmNkZtIBAA?hl=en-GB&gl=GB&ceid=GB%3Aen,Twitter threatens trade secrets lawsuit over Meta's Threads app,ft,2023-07-06,07:00:00
https://news.google.com/articles/CBMiP2h0dHBzOi8vd3d3LmZ0LmNvbS9jb250ZW50L2FlN2RkMzI5LTk5MGEtNDFlMC04ZTNjLTJkYzU0YjQ0M2I3ONIBAA?hl=en-GB&gl=GB&ceid=GB%3Aen,Meta's Threads is a throwback to the giddy early days of Twitter,ft,2023-07-06,07:00:00
https://news.google.com/articles/CBMiYWh0dHBzOi8vd3d3Lndzai5jb20vYXJ0aWNsZXMvdGVzbGEtam9pbnMtY2hpbmVzZS1jYXJtYWtlcnMtaW4tcGxlZGdlLXRvLWVuZC1ldi1wcmljZS13YXItNDcyMjNiZDnSAQA?hl=en-GB&gl=GB&ceid=GB%3Aen,Tesla Joins Chinese Carmakers in Pledge to End EV Price War,wsj,2023-07-06,07:00:00
https://news.google.com/articles/CBMiMGh0dHBzOi8vd3d3LmJiYy5jb20vc29tYWxpL2FydGljbGVzL2NrdnpnazN4ZXE5b9IBNGh0dHBzOi8vd3d3LmJiYy5jb20vc29tYWxpL2FydGljbGVzL2NrdnpnazN4ZXE5by5hbXA?hl=en-GB&gl=GB&ceid=GB%3Aen,Sababta ay Twitter ugu hanjabtay in tallaabo sharci ay ka qaadi doonto Meta,bbc,2023-07-07,07:00:00
https://news.google.com/articles/CBMiMGh0dHBzOi8vd3d3LmJiYy5jb20vZ2FodXphL2FydGljbGVzL2N6a24weXB4N2p6b9IBNGh0dHBzOi8vd3d3LmJiYy5jb20vZ2FodXphL2FydGljbGVzL2N6a24weXB4N2p6by5hbXA?hl=en-GB&gl=GB&ceid=GB%3Aen,Twitter yakangishije kurega Meta mu rukiko kubera 'app' yayo Threads,bbc,2023-07-07,07:00:00
https://news.google.com/articles/CBMipAFodHRwczovL3d3dy5mb3JiZXMuY29tL3NpdGVzL3NpbGFkaXR5YXJheS8yMDIzLzA3LzA3L211c2stY2FsbHMtb3V0LW1ldGFzLWFsZ29yaXRobS1vbmx5LWFwcHJvYWNoLWFuZC1zb2NpYWwtbWVkaWEtbW9ub3BvbHktYWZ0ZXItdGhyZWFkcy1oaXRzLTMwLW1pbGxpb24tbWlsZXN0b25lL9IBAA?hl=en-GB&gl=GB&ceid=GB%3Aen,Musk Calls Out Meta's 'Algorithm-Only' Approach And 'Social Media Monopoly' After Threads Hits 30 Million Milestone,forbes,2023-07-07,07:00:00
https://news.google.com/articles/CBMicGh0dHBzOi8vd3d3LmJsb29tYmVyZy5jb20vbmV3cy9hcnRpY2xlcy8yMDIzLTA3LTA3L2V1LXVzZXJzLWZpbmQtd2F5cy10by1kb3dubG9hZC1tZXRhLXMtdW5hdmFpbGFibGUtdGhyZWFkcy1hcHDSAQA?hl=en-GB&gl=GB&ceid=GB%3Aen,EU Users Find Ways to Download Meta's Unavailable Threads App,bloomberg,2023-07-07,07:00:00
https://news.google.com/articles/CBMiP2h0dHBzOi8vd3d3LmZ0LmNvbS9jb250ZW50L2QwMjE1YzdjLTkwZTUtNGU1My1iNWVhLWExOTE0MDczMGIyMdIBAA?hl=en-GB&gl=GB&ceid=GB%3Aen,Meta singled out by UK financial lobby group over digital scams,ft,2023-07-08,07:00:00
https://news.google.com/articles/CBMiUGh0dHBzOi8vd3d3Lm55dGltZXMuY29tLzIwMjMvMDcvMTAvYXJ0cy9zYXJhaC1zaWx2ZXJtYW4tbGF3c3VpdC1vcGVuYWktbWV0YS5odG1s0gEA?hl=en-GB&gl=GB&ceid=GB%3Aen,Sarah Silverman Sues OpenAI and Meta Over Copyright Infringement,nytimes,2023-07-10,07:00:00
https://news.google.com/articles/CBMiW2h0dHBzOi8vd3d3Lm55dGltZXMuY29tLzIwMjMvMDcvMDgvYnVzaW5lc3MvZGVhbGJvb2svenVja2VyYmVyZy1tZXRhLXRocmVhZHMtYW50aXRydXN0Lmh0bWzSAQA?hl=en-GB&gl=GB&ceid=GB%3Aen,The Regulatory Questions Swirling Around Meta’s Threads,nytimes,2023-07-10,07:00:00
https://news.google.com/articles/CBMiSGh0dHBzOi8vd3d3Lndzai5jb20vYXJ0aWNsZXMvYW1hem9uLWhhcy1hLWxvdC1vZi1wdW1wcy10by1wcmltZS0zNDM3NjVhZtIBAA?hl=en-GB&gl=GB&ceid=GB%3Aen,Amazon Has a Lot of Pumps to Prime,wsj,2023-07-11,07:00:00
https://news.google.com/articles/CBMiT2h0dHBzOi8vd3d3Lndzai5jb20vYXJ0aWNsZXMvYW1hem9ucy1wcmltZS1kYXktdG8tdGVzdC1jb25zdW1lci1kZW1hbmQtY2M5NzYyODjSAQA?hl=en-GB&gl=GB&ceid=GB%3Aen,Amazon's Prime Day Tests Consumer Demand - WSJ,wsj,2023-07-11,07:00:00
https://news.google.com/articles/CBMijgFodHRwczovL3d3dy5mb3JiZXMuY29tL3NpdGVzL2VyaWtrYWluLzIwMjMvMDcvMTEvZXZlcnl0aGluZy15b3UtbmVlZC10by1rbm93LWFib3V0LWFtYXpvbi1wcmltZS1kYXktMjAyMy0tLXdoYXQtdG8tbG9vay1mb3ItYW5kLXdoYXQtdG8tYXZvaWQv0gEA?hl=en-GB&gl=GB&ceid=GB%3Aen,Everything You Need To Know About Amazon Prime Day 2023 — What To Look For And What To Avoid,forbes,2023-07-11,07:00:00
https://news.google.com/articles/CBMiLGh0dHBzOi8vd3d3LmJiYy5jb20vbmV3cy90ZWNobm9sb2d5LTY2MTU1NDMz0gEwaHR0cHM6Ly93d3cuYmJjLmNvbS9uZXdzL3RlY2hub2xvZ3ktNjYxNTU0MzMuYW1w?hl=en-GB&gl=GB&ceid=GB%3Aen,Meta plans feed for Threads after users complain,bbc,2023-07-11,07:00:00
https://news.google.com/articles/CBMikgFodHRwczovL3d3dy53c2ouY29tL2FydGljbGVzL2xpbmEta2hhbi1hY3RpdmlzaW9uLWJsaXp6YXJkLW1pY3Jvc29mdC1qdWRnZS1qYWNxdWVsaW5lLXNjb3R0LWNvcmxleS1mZWRlcmFsLXRyYWRlLWNvbW1pc3Npb24tYW50aXRydXN0LWxhdy01MmNkMWE2NdIBAA?hl=en-GB&gl=GB&ceid=GB%3Aen,Opinion | Lina Khan Whiffs on the Microsoft-Activision Tie-Up,wsj,2023-07-11,07:00:00
https://news.google.com/articles/CBMifGh0dHBzOi8vd3d3Lndzai5jb20vdmlkZW8vbWljcm9zb2Z0LWNhbi1hY3F1aXJlLWFjdGl2aXNpb24tYmxpenphcmQtZmVkZXJhbC1qdWRnZS1ydWxlcy84MTc1NEVCNS1CQzQzLTQyQkQtOTA5Qy00MUU3Q0IzREUxQTTSAQA?hl=en-GB&gl=GB&ceid=GB%3Aen,"Microsoft Can Acquire Activision Blizzard, Federal Judge Rules",wsj,2023-07-11,07:00:00
https://news.google.com/articles/CBMiUGh0dHBzOi8vd3d3Lm55dGltZXMuY29tLzIwMjMvMDcvMTEvdGVjaG5vbG9neS9taWNyb3NvZnQtYWN0aXZpc2lvbi1kZWFsLWZ0Yy5odG1s0gEA?hl=en-GB&gl=GB&ceid=GB%3Aen,FTC Court Ruling Clears Path for Microsoft to Buy Activision,nytimes,2023-07-11,07:00:00
https://news.google.com/articles/CBMiSWh0dHBzOi8vd3d3Lm55dGltZXMuY29tLzIwMjMvMDcvMTEvdGVjaG5vbG9neS9saW5hLWtoYW4tZnRjLXN0cmF0ZWd5Lmh0bWzSAQA?hl=en-GB&gl=GB&ceid=GB%3Aen,F.T.C.’s Lina Khan Faces Fresh Questions After Microsoft Ruling,nytimes,2023-07-11,07:00:00
https://news.google.com/articles/CBMiVmh0dHBzOi8vd3d3Lm55dGltZXMuY29tLzIwMjMvMDcvMTEvdXMvcG9saXRpY3MvY2hpbmEtaGFjay11cy1nb3Zlcm5tZW50LW1pY3Jvc29mdC5odG1s0gEA?hl=en-GB&gl=GB&ceid=GB%3Aen,"Chinese Hackers Breached Government Email Accounts, Microsoft Says",nytimes,2023-07-11,07:00:00
https://news.google.com/articles/CBMiP2h0dHBzOi8vd3d3LmZ0LmNvbS9jb250ZW50L2IwNTcyMjdiLTg4NWUtNGQ5ZC04MTYzLWIyMTJkOTlmYWYyZdIBAA?hl=en-GB&gl=GB&ceid=GB%3Aen,"Live news updates from July 11: Microsoft-Activision deal clears hurdle, Apple to sell products on WeChat",ft,2023-07-11,07:00:00
https://news.google.com/articles/CBMiYGh0dHBzOi8vd3d3LmZvcmJlcy5jb20vc2l0ZXMvZ3JlYXRzcGVjdWxhdGlvbnMvMjAyMy8wNy8xMS93aGF0LXRvLWV4cGVjdC1mcm9tLXRlc2xhcy1xMi1yZXN1bHRzL9IBAA?hl=en-GB&gl=GB&ceid=GB%3Aen,What To Expect From Tesla's Q2 Results?,forbes,2023-07-11,07:00:00
https://news.google.com/articles/CBMiP2h0dHBzOi8vd3d3LmZ0LmNvbS9jb250ZW50LzFjYmVlZWUwLWJmZDktNDQ2ZC04YzZmLTQ2Y2E2OWI2ZDAxNdIBAA?hl=en-GB&gl=GB&ceid=GB%3Aen,FirstFT: Arm seeks Nvidia as anchor investor ahead of New York listing,ft,2023-07-12,07:00:00
https://news.google.com/articles/CBMiWWh0dHBzOi8vd3d3Lndzai5jb20vYnV5c2lkZS9zaG9wcGluZy1ob2xpZGF5cy9wcmltZS12aWRlby1zdHJlYW1pbmctYWRkLW9uLWRlYWxzLTkzMTA5OWFm0gEA?hl=en-GB&gl=GB&ceid=GB%3Aen,Streaming Deals: Best Amazon Prime Video Add Ons 2023 - Buy Side from WSJ,wsj,2023-07-12,07:00:00
https://news.google.com/articles/CBMiWGh0dHBzOi8vd3d3Lndzai5jb20vYnV5c2lkZS9zaG9wcGluZy1ob2xpZGF5cy9hbWF6b24tcHJpbWUtZGF5LXN0YWZmLXBpY2tzLTIwMjMtM2YxNjEwYjPSAQA?hl=en-GB&gl=GB&ceid=GB%3Aen,Buy Side Staffers' Favorite Deals On Amazon Prime Day 2023 - Buy Side from WSJ,wsj,2023-07-12,07:00:00
https://news.google.com/articles/CBMiP2h0dHBzOi8vd3d3LmZ0LmNvbS9jb250ZW50L2RjNjU4MjUyLTZhY2QtNDRmYy04ZTBjLTUxYTI4NDAwOTc2MtIBAA?hl=en-GB&gl=GB&ceid=GB%3Aen,'We're not Amazon': tensions with Ukraine surface at Nato summit,ft,2023-07-12,07:00:00
https://news.google.com/articles/CBMiLGh0dHBzOi8vd3d3LmJiYy5jb20vbmV3cy90ZWNobm9sb2d5LTY2MTY0MjI40gEwaHR0cHM6Ly93d3cuYmJjLmNvbS9uZXdzL3RlY2hub2xvZ3ktNjYxNjQyMjguYW1w?hl=en-GB&gl=GB&ceid=GB%3Aen,Sarah Silverman sues OpenAI and Meta,bbc,2023-07-12,07:00:00
https://news.google.com/articles/CBMiU2h0dHBzOi8vd3d3Lm55dGltZXMuY29tLzIwMjMvMDcvMTIvdGVjaG5vbG9neS9wZXJzb25hbHRlY2gvbWV0YS10aHJlYWRzLXJldmlldy5odG1s0gEA?hl=en-GB&gl=GB&ceid=GB%3Aen,Threads Review: How Meta's New App Stacks Up Against Twitter,nytimes,2023-07-12,07:00:00
https://news.google.com/articles/CBMiP2h0dHBzOi8vd3d3LmZ0LmNvbS9jb250ZW50LzAxZmQ2NDBlLTBjNmItNDU0Mi1iODJiLTIwYWZiMjAzZjI3MdIBAA?hl=en-GB&gl=GB&ceid=GB%3Aen,Meta to release commercial AI model in effort to catch rivals,ft,2023-07-12,07:00:00
https://news.google.com/articles/CBMiV2h0dHBzOi8vd3d3Lm55dGltZXMuY29tLzIwMjMvMDcvMTIvYnVzaW5lc3MvZGVhbGJvb2svbWljcm9zb2Z0LWFjdGl2aXNpb24tZnRjLWtoYW4uaHRtbNIBAA?hl=en-GB&gl=GB&ceid=GB%3Aen,What the Microsoft-Activision Ruling Means for the Future of Deal-Making,nytimes,2023-07-12,07:00:00
https://news.google.com/articles/CBMiP2h0dHBzOi8vd3d3LmZ0LmNvbS9jb250ZW50L2UwMGQ5ODc4LWExMTYtNGQ1Yi1hYzM3LTIwYWMzYzY0M2IxMtIBAA?hl=en-GB&gl=GB&ceid=GB%3Aen,"Microsoft and Activision exploring changes to $75bn deal, says UK regulator",ft,2023-07-12,07:00:00
https://news.google.com/articles/CBMiP2h0dHBzOi8vd3d3LmZ0LmNvbS9jb250ZW50L2Y4OTQyMmRhLWEzYjItNDUzNC05Y2UzLWU5MGRkNTY0OGQyN9IBAA?hl=en-GB&gl=GB&ceid=GB%3Aen,Microsoft-Activision ruling represents setback for FTC chair Lina Khan,ft,2023-07-12,07:00:00
https://news.google.com/articles/CBMigQFodHRwczovL3d3dy5ibG9vbWJlcmcuY29tL25ld3MvYXJ0aWNsZXMvMjAyMy0wNy0xMi9nb29nbGUtcy1tZWQtcGFsbS1haS1wcm9kdWN0LWZvci1tZWRpY2FsLWluZHVzdHJ5LWlzbi10LXJlYWR5LWZvci1wYXRpZW50cy15ZXTSAQA?hl=en-GB&gl=GB&ceid=GB%3Aen,Google’s AI for Medicine Shows Clinical Answers More Than 90% Accurate,bloomberg,2023-07-12,07:00:00
https://news.google.com/articles/CBMiS2h0dHBzOi8vd3d3Lm55dGltZXMuY29tLzIwMjMvMDcvMTIvd29ybGQvZXVyb3BlL3VrLXVrcmFpbmUtYmVuLXdhbGxhY2UuaHRtbNIBAA?hl=en-GB&gl=GB&ceid=GB%3Aen,'We're Not Amazon': Britain's Defense Minister Says Ukrainian Officials Should Show More Gratitude,nytimes,2023-07-13,07:00:00
https://news.google.com/articles/CBMijAFodHRwczovL3d3dy5mb3JiZXMuY29tL3NpdGVzL3NpbGFkaXR5YXJheS8yMDIzLzA3LzEzL25scmItZmlsZXMtY29tcGxhaW50LWFnYWluc3QtYW1hem9uLWZvci1yZWZ1c2luZy10by1iYXJnYWluLXdpdGgtd2FyZWhvdXNlLWxhYm9yLXVuaW9uL9IBAA?hl=en-GB&gl=GB&ceid=GB%3Aen,NLRB Files Complaint Against Amazon For Refusing To Bargain With Warehouse Labor Union,forbes,2023-07-13,07:00:00
https://news.google.com/articles/CBMib2h0dHBzOi8vd3d3LmJsb29tYmVyZy5jb20vbmV3cy9hcnRpY2xlcy8yMDIzLTA3LTEzL21ldGEtcy10aHJlYWRzLXRvLXJhaXNlLXN0YWtlcy1mb3Itc25hcC1waW50ZXJlc3QtdGVjaC13YXRjaNIBAA?hl=en-GB&gl=GB&ceid=GB%3Aen,"Meta's Threads to Raise Stakes for Snap, Pinterest",bloomberg,2023-07-13,07:00:00
https://news.google.com/articles/CBMid2h0dHBzOi8vd3d3Lndzai5jb20vYXJ0aWNsZXMvY2hpbmEtaGFja2luZy13YXMtdW5kZXRlY3RhYmxlLWZvci1zb21lLXdoby1oYWQtbGVzcy1leHBlbnNpdmUtbWljcm9zb2Z0LXNlcnZpY2VzLTU4NzMwNjI50gEA?hl=en-GB&gl=GB&ceid=GB%3Aen,China Hacking Was Undetectable for Some Who Had Less Expensive Microsoft Services,wsj,2023-07-13,07:00:00
https://news.google.com/articles/CBMiP2h0dHBzOi8vd3d3LmZ0LmNvbS9jb250ZW50LzU5OWU3YmEyLTFlNzQtNDMyNi04Y2UyLWQ0YTQ3YzZmNzZhNtIBAA?hl=en-GB&gl=GB&ceid=GB%3Aen,Google releases chatbot in Europe after addressing privacy concerns,ft,2023-07-13,07:00:00
https://news.google.com/articles/CBMihgFodHRwczovL3d3dy53c2ouY29tL2xpdmVjb3ZlcmFnZS9zdG9jay1tYXJrZXQtdG9kYXktZWFybmluZ3MtMDctMTQtMjAyMy9jYXJkL21pY3Jvc29mdC1zdG9jay1oZWFkcy1mb3ItYS1uZXctaGlnaC1ySHl4MXJ1VE0zY0pjMmVyVkZCc9IBAA?hl=en-GB&gl=GB&ceid=GB%3Aen,Microsoft Stock Heads for a New High,wsj,2023-07-14,07:00:00
https://news.google.com/articles/CBMicmh0dHBzOi8vd3d3Lndzai5jb20vYXJ0aWNsZXMvbWljcm9zb2Z0LWVtYWlsLWhhY2stc2hvd3MtZ3JlYXRlci1zb3BoaXN0aWNhdGlvbi1za2lsbC1vZi1jaGluYXMtY3liZXJzcGllcy03ZjdjZmY2N9IBAA?hl=en-GB&gl=GB&ceid=GB%3Aen,"Microsoft Email Hack Shows Greater Sophistication, Skill of China's Cyberspies",wsj,2023-07-14,07:00:00
https://news.google.com/articles/CBMiP2h0dHBzOi8vd3d3LmZ0LmNvbS9jb250ZW50LzYxM2M2Zjg0LTJiMDQtNDNlYS04MjA4LTIxOWYxYTkxNDYzMtIBAA?hl=en-GB&gl=GB&ceid=GB%3Aen,UK regulators open door to quick Microsoft-Activision deal,ft,2023-07-14,07:00:00
